{
  "schema_version": 1,
  "entity": "render-theme",
  "asset_id": "builtin:theme:spark-night-dark",
  "name": "星火夜空风渲染主题",
  "default_mode": "dark",
  "modes": {
    "dark": {
      "background": "#0A2E5C",
      "surface": "#123B70",
      "text": "#FFFFFF",
      "primary": "#FF8C42",
      "on_primary": "#182B42",
      "muted": "#C2D6EC",
      "border": "#59789E",
      "accent": "#70B3FF",
      "warn": "#FFD284"
    }
  },
  "font_roles": {
    "title": {
      "family": "Noto Sans SC",
      "weight": 700,
      "size": 46,
      "line_height": 1.25
    },
    "body": {
      "family": "Noto Sans SC",
      "weight": 400,
      "size": 25,
      "line_height": 1.5
    },
    "kicker": {
      "family": "Noto Sans SC",
      "weight": 400,
      "size": 22,
      "line_height": 1.4
    },
    "table_header": {
      "family": "Noto Sans SC",
      "weight": 700,
      "size": 26,
      "line_height": 1.3
    },
    "table_body": {
      "family": "Noto Sans SC",
      "weight": 400,
      "size": 25,
      "line_height": 1.5
    },
    "page_no": {
      "family": "Noto Sans SC",
      "weight": 400,
      "size": 22,
      "line_height": 1.2
    }
  },
  "chart_palette": {
    "series": [
      "#FF8C42",
      "#70B3FF",
      "#C2D6EC"
    ],
    "positive": "#6ED4A6",
    "negative": "#FF9C9C"
  },
  "ornaments": [],
  "qa_profile": null,
  "static_support": {
    "lanes": [
      "html",
      "image"
    ]
  },
  "overrideable_roles": [
    "accent",
    "muted",
    "surface"
  ]
}
