{
  "schema_version": 1,
  "entity": "render-theme",
  "asset_id": "builtin:theme:finance-navy-light",
  "name": "finance navy light",
  "default_mode": "light",
  "modes": {
    "light": {
      "background": "#F8FAFC",
      "surface": "#FFFFFF",
      "text": "#1F2430",
      "primary": "#1E3A8A",
      "on_primary": "#FFFFFF",
      "muted": "#475569",
      "border": "#64748B",
      "accent": "#0369A1",
      "warn": "#92400E"
    }
  },
  "font_roles": {
    "title": {
      "family": "Noto Sans SC",
      "weight": 700,
      "size": 46,
      "line_height": 1.25
    },
    "body": {
      "family": "Noto Sans SC",
      "weight": 400,
      "size": 25,
      "line_height": 1.5
    },
    "kicker": {
      "family": "Noto Sans SC",
      "weight": 400,
      "size": 22,
      "line_height": 1.4
    },
    "table_header": {
      "family": "Noto Sans SC",
      "weight": 700,
      "size": 26,
      "line_height": 1.3
    },
    "table_body": {
      "family": "Noto Sans SC",
      "weight": 400,
      "size": 25,
      "line_height": 1.5
    },
    "page_no": {
      "family": "Noto Sans SC",
      "weight": 400,
      "size": 22,
      "line_height": 1.2
    }
  },
  "chart_palette": {
    "series": [
      "#1E3A8A",
      "#0369A1",
      "#64748B"
    ],
    "positive": "#15803D",
    "negative": "#B4232A"
  },
  "ornaments": [],
  "qa_profile": null,
  "static_support": {
    "lanes": [
      "html",
      "image"
    ]
  },
  "overrideable_roles": [
    "accent",
    "muted",
    "surface"
  ]
}
